{
    "event_id": "2025-12-07_i_idol-koshien",
    "event_name": "ã‚¢ã‚¤ãƒ‰ãƒ«âš¾ç”²å­åœ’âš¾ in KANDA SQUARE HALL",
    "date": "2025-12-07",
    "venue": "KANDA SQUARE HALL",
    "open_time": "10:00",
    "start_time": "10:30",
    "stages": [
        {
            "stage_id": "main",
            "stage_name": "ãƒ¡ã‚¤ãƒ³ã‚¹ãƒ†ãƒ¼ã‚¸",
            "stage_description": "ãƒ¡ã‚¤ãƒ³ã‚¹ãƒ†ãƒ¼ã‚¸ã§ã®å‡ºæ¼”"
        }
    ],
    "timetable": [
        {
            "stage_id": "main",
            "start": "10:30",
            "end": "10:45",
            "act": "ã‚ªãƒ¼ãƒ—ãƒ‹ãƒ³ã‚°MC",
            "type": "mc"
        },
        {
            "stage_id": "main",
            "start": "10:45",
            "end": "11:00",
            "act": "ã‚µãƒ³ãƒ—ãƒ«ã‚¢ãƒ¼ãƒ†ã‚£ã‚¹ãƒˆA",
            "type": "artist",
            "description": "1stã‚¹ãƒ†ãƒ¼ã‚¸",
            "emoji": "ğŸ¤"
        },
        {
            "stage_id": "main",
            "start": "11:00",
            "end": "11:15",
            "act": "ã‚µãƒ³ãƒ—ãƒ«ã‚¢ãƒ¼ãƒ†ã‚£ã‚¹ãƒˆB",
            "type": "artist",
            "emoji": "ğŸ¸"
        }
    ]
}